{
  "$schema": "../schemas/omk.theme.v1.schema.json",
  "schemaVersion": "omk.theme.v1",
  "name": "night-city",
  "displayName": "OMK//CONTROL — Night City Ops Console",
  "mode": "dark",
  "primitives": {
    "dark": "#070B14",
    "surface": "#101826",
    "cyan": "#00D6FF",
    "mint": "#00FFC2",
    "magenta": "#FF47B2",
    "purple": "#9D4EDD",
    "amber": "#FFB000",
    "red": "#FF5874",
    "cream": "#E8F8FF",
    "muted": "#9DB3C7",
    "gray": "#758FA8"
  },
  "backgrounds": [
    "dark",
    "surface"
  ],
  "semantics": {
    "route.active": {
      "color": "cyan",
      "glyph": "▸",
      "usage": "text"
    },
    "route.fallback": {
      "color": "amber",
      "glyph": "↻",
      "usage": "text"
    },
    "route.dead": {
      "color": "red",
      "glyph": "✕",
      "usage": "text"
    },
    "evidence.pass": {
      "color": "mint",
      "glyph": "✓",
      "usage": "text"
    },
    "evidence.fail": {
      "color": "red",
      "glyph": "✗",
      "usage": "text"
    },
    "evidence.pending": {
      "color": "amber",
      "glyph": "◐",
      "usage": "text"
    },
    "dag.lane.running": {
      "color": "cyan",
      "glyph": "▶",
      "usage": "text"
    },
    "dag.lane.blocked": {
      "color": "amber",
      "glyph": "⏸",
      "usage": "text"
    },
    "dag.lane.done": {
      "color": "mint",
      "glyph": "●",
      "usage": "text"
    },
    "dag.lane.queued": {
      "color": "muted",
      "glyph": "◌",
      "usage": "text"
    },
    "telemetry.info": {
      "color": "cream",
      "glyph": "·",
      "usage": "text"
    },
    "telemetry.warn": {
      "color": "amber",
      "glyph": "▲",
      "usage": "text"
    },
    "telemetry.error": {
      "color": "red",
      "glyph": "✖",
      "usage": "text"
    },
    "control.accent": {
      "color": "purple",
      "glyph": "◆",
      "kind": "chrome",
      "usage": "indicator"
    },
    "control.dim": {
      "color": "gray",
      "glyph": "┊",
      "kind": "chrome",
      "usage": "text"
    },
    "control.fg": {
      "color": "cream",
      "kind": "chrome",
      "usage": "text"
    },
    "control.bg": {
      "color": "dark",
      "kind": "background",
      "usage": "background"
    }
  },
  "components": {
    "statusCard": {
      "border": "control.accent",
      "title": "control.fg",
      "body": "telemetry.info",
      "meta": "control.dim"
    },
    "routerTable": {
      "active": "route.active",
      "fallback": "route.fallback",
      "dead": "route.dead",
      "header": "control.accent"
    },
    "evidenceGate": {
      "pass": "evidence.pass",
      "fail": "evidence.fail",
      "pending": "evidence.pending"
    },
    "dagLanes": {
      "running": "dag.lane.running",
      "blocked": "dag.lane.blocked",
      "done": "dag.lane.done",
      "queued": "dag.lane.queued"
    },
    "logStream": {
      "info": "telemetry.info",
      "warn": "telemetry.warn",
      "error": "telemetry.error",
      "dim": "control.dim"
    }
  },
  "fallback16": {
    "route.active": "brightCyan",
    "route.fallback": "brightYellow",
    "route.dead": "brightRed",
    "evidence.pass": "brightGreen",
    "evidence.fail": "brightRed",
    "evidence.pending": "brightYellow",
    "dag.lane.running": "brightCyan",
    "dag.lane.blocked": "brightYellow",
    "dag.lane.done": "brightGreen",
    "dag.lane.queued": "white",
    "telemetry.info": "brightWhite",
    "telemetry.warn": "brightYellow",
    "telemetry.error": "brightRed",
    "control.accent": "brightMagenta",
    "control.dim": "white",
    "control.fg": "brightWhite",
    "control.bg": "black"
  },
  "meta": {
    "provenance": "Canonical Night City palette extracted from readmeasset/ASSET_PROVENANCE.md theme mapping + SVG frequency analysis (proof/theme-2026-06-10/phase0-recon.md). #101826 surface and #9DB3C7 muted promoted from SVG/provenance into primitives; src/brand/palette.ts gray #758FA8 kept as control.dim.",
    "reservedPrimitives": {
      "magenta": "#FF47B2 is reserved brand accent, referenced by no semantic role yet, so it is not contrast-gated. If a future role adopts it the theme:check gate applies automatically (quantizes to xterm idx 205 #FF5FAF; CR 7.07/6.39 on quantized dark/surface — passes). See proof/theme-2026-06-10/t3-a11y-review.md §5."
    },
    "tierAssumptions": "16-color tier is gated against stock VGA/xterm ANSI values; terminals with remapped ANSI-16 palettes (e.g. Solarized) are outside the contract — glyphs are the safety net. NO_COLOR note: control.dim uses ┊ so logStream info (telemetry.info ·) and dim rows stay distinguishable without color (t3-a11y-review.md §4).",
    "derivedAssets": [
      "readmeasset/omk-badges.svg",
      "readmeasset/omk-core-loop.svg",
      "readmeasset/omk-evidence-ledger.svg",
      "readmeasset/omk-logo-mark.svg",
      "readmeasset/omk-provider-lanes.svg"
    ],
    "omkVersion": "0.80.2"
  }
}
